11:57:11.625157 IP 149.156.99.123 > 149.156.96.21: icmp 40: echo request seq 11008
11:57:11.625810 IP 149.156.96.21 > 149.156.99.123: icmp 40: echo reply seq 11008
11:57:12.617153 IP 149.156.99.123 > 149.156.96.21: icmp 40: echo request seq 11264
11:57:12.617722 IP 149.156.96.21 > 149.156.99.123: icmp 40: echo reply seq 11264
11:57:13.617003 IP 149.156.99.123 > 149.156.96.21: icmp 40: echo request seq 11520
11:57:13.617576 IP 149.156.96.21 > 149.156.99.123: icmp 40: echo reply seq 11520
11:57:13.923781 IP 149.156.99.123.1791 > 66.102.9.99.80: P 1560712269:1560712573(304) ack 2114831406 win 65535
11:57:13.980726 IP 66.102.9.99.80 > 149.156.99.123.1791: . ack 304 win 7886
11:57:13.981908 IP 66.102.9.99.80 > 149.156.99.123.1791: . ack 304 win 6432
11:57:13.986793 IP 66.102.9.99.80 > 149.156.99.123.1791: P 1431:1636(205) ack 304 win 6432
11:57:13.987073 IP 149.156.99.123.1791 > 66.102.9.99.80: . ack 1 win 65535
11:57:13.987712 IP 66.102.9.99.80 > 149.156.99.123.1791: . 1:1431(1430) ack 304 win 6432
11:57:13.988090 IP 149.156.99.123.1791 > 66.102.9.99.80: . ack 1636 win 65535
11:57:14.405572 IP 149.156.99.123.1791 > 66.102.9.99.80: P 304:704(400) ack 1636 win 65535
11:57:14.466063 IP 66.102.9.99.80 > 149.156.99.123.1791: P 1636:1763(127) ack 704 win 7504
11:57:14.470157 IP 149.156.99.123.1791 > 66.102.9.99.80: P 704:1104(400) ack 1763 win 65408
11:57:14.517883 IP 149.156.99.123.1795 > 66.102.9.99.80: S 937129991:937129991(0) win 65535 <mss 1460,nop,nop,sackOK>
11:57:14.531672 IP 66.102.9.99.80 > 149.156.99.123.1791: P 1763:1890(127) ack 1104 win 8576
11:57:14.535265 IP 149.156.99.123.1791 > 66.102.9.99.80: P 1104:1504(400) ack 1890 win 65281
11:57:14.574529 IP 66.102.9.99.80 > 149.156.99.123.1795: S 2791268293:2791268293(0) ack 937129992 win 8190 <mss 1460>
11:57:14.574901 IP 149.156.99.123.1795 > 66.102.9.99.80: . ack 1 win 65535
11:57:14.575613 IP 149.156.99.123.1795 > 66.102.9.99.80: P 1:401(400) ack 1 win 65535
11:57:14.594735 IP 66.102.9.99.80 > 149.156.99.123.1791: P 1890:2017(127) ack 1504 win 9648
11:57:14.618725 IP 149.156.99.123 > 149.156.96.21: icmp 40: echo request seq 11776
11:57:14.619281 IP 149.156.96.21 > 149.156.99.123: icmp 40: echo reply seq 11776
11:57:14.632558 IP 66.102.9.99.80 > 149.156.99.123.1795: . ack 401 win 7790
11:57:14.633633 IP 66.102.9.99.80 > 149.156.99.123.1795: . ack 401 win 6432
11:57:14.637190 IP 66.102.9.99.80 > 149.156.99.123.1795: P 1:128(127) ack 401 win 6432
11:57:14.804365 IP 149.156.99.123.1795 > 66.102.9.99.80: . ack 128 win 65408
11:57:14.804458 IP 149.156.99.123.1791 > 66.102.9.99.80: . ack 2017 win 65154
11:57:22.661200 IP 149.156.99.123.1796 > 149.156.195.60.22: S 2010193204:2010193204(0) win 65535 <mss 1460,nop,nop,sackOK>
11:57:22.661902 IP 149.156.195.60.22 > 149.156.99.123.1796: S 3243105034:3243105034(0) ack 2010193205 win 24820 <nop,nop,sackOK,mss 1460>
11:57:22.662248 IP 149.156.99.123.1796 > 149.156.195.60.22: . ack 1 win 65535
11:57:22.666943 IP 149.156.195.60.38691 > 149.156.99.123.113: S 3243196372:3243196372(0) win 24820 <nop,nop,sackOK,mss 1460>
11:57:23.662235 IP 149.156.195.60.38691 > 149.156.99.123.113: R 3243196373:3243196373(0) win 24820
11:57:23.662671 IP 149.156.195.60.22 > 149.156.99.123.1796: P 1:26(25) ack 1 win 24820
11:57:23.664405 IP 149.156.99.123.1796 > 149.156.195.60.22: P 1:28(27) ack 26 win 65510
11:57:23.664901 IP 149.156.195.60.22 > 149.156.99.123.1796: . ack 28 win 24820
11:57:23.668314 IP 149.156.195.60.22 > 149.156.99.123.1796: P 26:302(276) ack 28 win 24820
11:57:23.685880 IP 149.156.99.123.1796 > 149.156.195.60.22: P 28:184(156) ack 302 win 65234
11:57:23.699457 IP 149.156.195.60.22 > 149.156.99.123.1796: P 302:314(12) ack 184 win 24820
11:57:23.882250 IP 149.156.99.123.1796 > 149.156.195.60.22: . ack 314 win 65222
11:57:26.016035 IP 149.156.99.123.1796 > 149.156.195.60.22: P 184:204(20) ack 314 win 65222
11:57:26.019022 IP 149.156.195.60.22 > 149.156.99.123.1796: P 314:326(12) ack 204 win 24820
11:57:26.179073 IP 149.156.99.123.1796 > 149.156.195.60.22: . ack 326 win 65210
11:57:29.632363 IP 149.156.99.123.1792 > 216.239.59.104.80: R 1285587092:1285587092(0) ack 3139916559 win 0
11:57:32.128214 IP 149.156.99.123.1797 > 149.156.99.9.110: S 422186102:422186102(0) win 65535 <mss 1460,nop,nop,sackOK>
11:57:32.128444 IP 149.156.99.9.110 > 149.156.99.123.1797: S 3247098751:3247098751(0) ack 422186103 win 32768 <mss 1460>
11:57:32.128784 IP 149.156.99.123.1797 > 149.156.99.9.110: . ack 1 win 65535
11:57:32.136226 IP 149.156.99.123.1798 > 217.74.64.236.995: S 4283077288:4283077288(0) win 65535 <mss 1460,nop,nop,sackOK>
11:57:32.147967 IP 217.74.64.236.995 > 149.156.99.123.1798: S 3327693224:3327693224(0) ack 4283077289 win 57344 <mss 1460>
11:57:32.148349 IP 149.156.99.123.1798 > 217.74.64.236.995: . ack 1 win 65535
11:57:32.171023 IP 149.156.99.123.1798 > 217.74.64.236.995: P 1:121(120) ack 1 win 65535
11:57:32.186881 IP 217.74.64.236.995 > 149.156.99.123.1798: P 1:947(946) ack 121 win 58400
11:57:32.200747 IP 149.156.99.123.1798 > 217.74.64.236.995: P 121:319(198) ack 947 win 64589
11:57:32.207856 IP 149.156.99.9.110 > 149.156.99.123.1797: P 1:14(13) ack 1 win 32768
11:57:32.227241 IP 149.156.99.123.1797 > 149.156.99.9.110: P 1:7(6) ack 14 win 65522
11:57:32.229792 IP 149.156.99.9.110 > 149.156.99.123.1797: P 14:180(166) ack 7 win 32768
11:57:32.244276 IP 149.156.99.123.1797 > 149.156.99.9.110: P 7:20(13) ack 180 win 65356
11:57:32.250356 IP 217.74.64.236.995 > 149.156.99.123.1798: P 947:1006(59) ack 319 win 58400
11:57:32.256748 IP 149.156.99.9.110 > 149.156.99.123.1797: P 180:215(35) ack 20 win 32768
11:57:32.258987 IP 149.156.99.123.1797 > 149.156.99.9.110: P 20:36(16) ack 215 win 65321
11:57:32.319709 IP 149.156.99.9.110 > 149.156.99.123.1797: . ack 36 win 32768
11:57:32.322870 IP 149.156.99.9.110 > 149.156.99.123.1797: P 215:274(59) ack 36 win 32768
11:57:32.337351 IP 149.156.99.123.1797 > 149.156.99.9.110: P 36:42(6) ack 274 win 65262
11:57:32.337637 IP 149.156.99.9.110 > 149.156.99.123.1797: P 274:283(9) ack 42 win 32768
11:57:32.352035 IP 149.156.99.123.1797 > 149.156.99.9.110: P 42:48(6) ack 283 win 65253
11:57:32.355478 IP 149.156.99.9.110 > 149.156.99.123.1797: P 283:336(53) ack 48 win 32768
11:57:32.381115 IP 149.156.99.9.110 > 149.156.99.123.1797: F 336:336(0) ack 48 win 32768
11:57:32.381571 IP 149.156.99.123.1797 > 149.156.99.9.110: . ack 337 win 65200
11:57:32.395923 IP 149.156.99.123.1797 > 149.156.99.9.110: F 48:48(0) ack 337 win 65200
11:57:32.396131 IP 149.156.99.9.110 > 149.156.99.123.1797: . ack 49 win 32768
11:57:32.413264 IP 149.156.99.123.1798 > 217.74.64.236.995: . ack 1006 win 64530
11:57:32.419191 IP 217.74.64.236.995 > 149.156.99.123.1798: P 1006:1112(106) ack 319 win 58400
11:57:32.445587 IP 149.156.99.123.1798 > 217.74.64.236.995: P 319:356(37) ack 1112 win 64424
11:57:32.452509 IP 217.74.64.236.995 > 149.156.99.123.1798: P 1112:1202(90) ack 356 win 58400
11:57:32.461454 IP 149.156.99.123.1798 > 217.74.64.236.995: P 356:409(53) ack 1202 win 64334
11:57:32.466406 IP 217.74.64.236.995 > 149.156.99.123.1798: P 1202:1276(74) ack 409 win 58400
11:57:32.476780 IP 149.156.99.123.1798 > 217.74.64.236.995: P 409:462(53) ack 1276 win 64260
11:57:32.553199 IP 217.74.64.236.995 > 149.156.99.123.1798: P 1276:1350(74) ack 462 win 58400
11:57:32.571405 IP 149.156.99.123.1798 > 217.74.64.236.995: P 462:499(37) ack 1350 win 64186
11:57:32.577421 IP 217.74.64.236.995 > 149.156.99.123.1798: P 1350:1424(74) ack 499 win 58400
11:57:32.587029 IP 149.156.99.123.1798 > 217.74.64.236.995: P 499:536(37) ack 1424 win 64112
11:57:32.596138 IP 217.74.64.236.995 > 149.156.99.123.1798: P 1424:1498(74) ack 536 win 58400
11:57:32.596438 IP 217.74.64.236.995 > 149.156.99.123.1798: F 1498:1498(0) ack 536 win 58400
11:57:32.596773 IP 149.156.99.123.1798 > 217.74.64.236.995: . ack 1499 win 65535
11:57:32.645046 IP 149.156.99.123.1798 > 217.74.64.236.995: P 536:573(37) ack 1499 win 65535
11:57:32.645400 IP 149.156.99.123.1798 > 217.74.64.236.995: F 573:573(0) ack 1499 win 65535
11:57:32.656113 IP 217.74.64.236.995 > 149.156.99.123.1798: R 3327694723:3327694723(0) win 0
11:57:32.670146 IP 149.156.99.123.1796 > 149.156.195.60.22: P 204:500(296) ack 326 win 65210
11:57:32.672789 IP 149.156.195.60.22 > 149.156.99.123.1796: P 326:338(12) ack 500 win 24820
11:57:32.850756 IP 149.156.99.123.1796 > 149.156.195.60.22: . ack 338 win 65198
11:57:37.996915 IP 149.156.99.123.1796 > 149.156.195.60.22: P 500:900(400) ack 338 win 65198
11:57:37.999242 IP 149.156.195.60.22 > 149.156.99.123.1796: P 338:350(12) ack 900 win 24820
11:57:38.000371 IP 149.156.99.123.1796 > 149.156.195.60.22: P 900:952(52) ack 350 win 65186
11:57:38.008039 IP 149.156.195.60.22 > 149.156.99.123.1796: P 350:362(12) ack 952 win 24820
11:57:38.009029 IP 149.156.99.123.1796 > 149.156.195.60.22: P 952:964(12) ack 362 win 65174
11:57:38.021850 IP 149.156.195.60.22 > 149.156.99.123.1796: P 362:438(76) ack 964 win 24820
11:57:38.071909 IP 149.156.195.60.22 > 149.156.99.123.1796: P 438:650(212) ack 964 win 24820
11:57:38.072273 IP 149.156.99.123.1796 > 149.156.195.60.22: . ack 650 win 64886
11:57:40.117720 IP 217.17.41.85.443 > 149.156.99.123.1049: P 3498108034:3498108061(27) ack 2229694313 win 5840
11:57:40.288062 IP 149.156.99.123.1049 > 217.17.41.85.443: . ack 27 win 65380
11:57:46.906061 IP 149.156.99.123 > 149.156.96.21: icmp 40: echo request seq 12032
11:57:46.906664 IP 149.156.96.21 > 149.156.99.123: icmp 40: echo reply seq 12032
11:57:47.897757 IP 149.156.99.123 > 149.156.96.21: icmp 40: echo request seq 12288
11:57:47.898306 IP 149.156.96.21 > 149.156.99.123: icmp 40: echo reply seq 12288
11:57:48.897349 IP 149.156.99.123 > 149.156.96.21: icmp 40: echo request seq 12544
11:57:48.897906 IP 149.156.96.21 > 149.156.99.123: icmp 40: echo reply seq 12544
11:57:49.897806 IP 149.156.99.123 > 149.156.96.21: icmp 40: echo request seq 12800
11:57:49.898510 IP 149.156.96.21 > 149.156.99.123: icmp 40: echo reply seq 12800
11:57:51.670780 IP 149.156.99.123 > 149.156.96.21: icmp 72: echo request seq 13056
11:57:51.671138 IP 149.156.99.17 > 149.156.99.123: icmp 120: time exceeded in-transit
11:57:51.671675 IP 149.156.99.123 > 149.156.96.21: icmp 72: echo request seq 13312
11:57:51.671977 IP 149.156.99.17 > 149.156.99.123: icmp 120: time exceeded in-transit
11:57:51.672513 IP 149.156.99.123 > 149.156.96.21: icmp 72: echo request seq 13568
11:57:51.672823 IP 149.156.99.17 > 149.156.99.123: icmp 120: time exceeded in-transit
11:57:52.663014 IP 149.156.99.123 > 149.156.96.21: icmp 72: echo request seq 13824
11:57:52.664220 IP 149.156.100.10 > 149.156.99.123: icmp 36: time exceeded in-transit
11:57:52.664737 IP 149.156.99.123 > 149.156.96.21: icmp 72: echo request seq 14080
11:57:52.665644 IP 149.156.100.10 > 149.156.99.123: icmp 36: time exceeded in-transit
11:57:52.666300 IP 149.156.99.123 > 149.156.96.21: icmp 72: echo request seq 14336
11:57:52.667180 IP 149.156.100.10 > 149.156.99.123: icmp 36: time exceeded in-transit
11:57:53.663416 IP 149.156.99.123 > 149.156.96.21: icmp 72: echo request seq 14592
11:57:53.664081 IP 149.156.96.21 > 149.156.99.123: icmp 72: echo reply seq 14592
11:57:53.664647 IP 149.156.99.123 > 149.156.96.21: icmp 72: echo request seq 14848
11:57:53.665235 IP 149.156.96.21 > 149.156.99.123: icmp 72: echo reply seq 14848
11:57:53.665739 IP 149.156.99.123 > 149.156.96.21: icmp 72: echo request seq 15104
11:57:53.666165 IP 149.156.96.21 > 149.156.99.123: icmp 72: echo reply seq 15104
11:57:54.420171 IP 149.156.99.123.1796 > 149.156.195.60.22: P 964:984(20) ack 650 win 64886
11:57:54.431412 IP 149.156.195.60.22 > 149.156.99.123.1796: P 650:670(20) ack 984 win 24820
11:57:54.536952 IP 149.156.99.123.1796 > 149.156.195.60.22: P 984:1004(20) ack 670 win 64866
11:57:54.551315 IP 149.156.195.60.22 > 149.156.99.123.1796: P 670:690(20) ack 1004 win 24820
11:57:54.725174 IP 149.156.99.123.1796 > 149.156.195.60.22: . ack 690 win 64846
11:57:55.186783 IP 149.156.99.123.1796 > 149.156.195.60.22: P 1004:1024(20) ack 690 win 64846
11:57:55.211445 IP 149.156.195.60.22 > 149.156.99.123.1796: P 690:790(100) ack 1024 win 24820
11:57:55.381401 IP 149.156.99.123.1796 > 149.156.195.60.22: . ack 790 win 64746
11:58:02.095411 IP 149.156.99.123 > 149.156.96.1: icmp 40: echo request seq 15360
11:58:06.033752 IP 149.156.99.123.1796 > 149.156.195.60.22: P 1024:1044(20) ack 790 win 64746
11:58:06.051179 IP 149.156.195.60.22 > 149.156.99.123.1796: P 790:810(20) ack 1044 win 24820
11:58:06.209247 IP 149.156.99.123.1796 > 149.156.195.60.22: . ack 810 win 64726
11:58:06.340554 IP 149.156.99.123.1796 > 149.156.195.60.22: P 1044:1064(20) ack 810 win 64726
11:58:06.361100 IP 149.156.195.60.22 > 149.156.99.123.1796: P 810:830(20) ack 1064 win 24820
11:58:06.457333 IP 149.156.99.123.1796 > 149.156.195.60.22: P 1064:1084(20) ack 830 win 64706
11:58:06.471097 IP 149.156.195.60.22 > 149.156.99.123.1796: P 830:850(20) ack 1084 win 24820
11:58:06.574097 IP 149.156.99.123.1796 > 149.156.195.60.22: P 1084:1104(20) ack 850 win 64686
11:58:06.591150 IP 149.156.195.60.22 > 149.156.99.123.1796: P 850:870(20) ack 1104 win 24820
11:58:06.743504 IP 149.156.99.123.1796 > 149.156.195.60.22: P 1104:1124(20) ack 870 win 64666
11:58:06.761076 IP 149.156.195.60.22 > 149.156.99.123.1796: P 870:890(20) ack 1124 win 24820
11:58:06.820358 IP 149.156.99.123.1796 > 149.156.195.60.22: P 1124:1144(20) ack 890 win 64646
11:58:06.841102 IP 149.156.195.60.22 > 149.156.99.123.1796: P 890:910(20) ack 1144 win 24820
11:58:06.974840 IP 149.156.99.123.1796 > 149.156.195.60.22: . ack 910 win 64626
11:58:07.015055 IP 149.156.99.123.1796 > 149.156.195.60.22: P 1144:1164(20) ack 910 win 64626
11:58:07.017145 IP 149.156.195.60.22 > 149.156.99.123.1796: P 910:930(20) ack 1164 win 24820
11:58:07.022428 IP 149.156.195.60.22 > 149.156.99.123.1796: P 930:950(20) ack 1164 win 24820
11:58:07.022789 IP 149.156.99.123.1796 > 149.156.195.60.22: . ack 950 win 64586
11:58:07.024026 IP 149.156.99.123.1796 > 149.156.195.60.22: P 1164:1176(12) ack 950 win 64586
11:58:07.024419 IP 149.156.99.123.1796 > 149.156.195.60.22: F 1176:1176(0) ack 950 win 64586
11:58:07.024631 IP 149.156.195.60.22 > 149.156.99.123.1796: F 950:950(0) ack 1176 win 24820
11:58:07.024859 IP 149.156.99.123.1796 > 149.156.195.60.22: . ack 951 win 64586
11:58:07.025269 IP 149.156.195.60.22 > 149.156.99.123.1796: . ack 1177 win 24820
11:58:07.213630 IP 149.156.99.123 > 149.156.96.1: icmp 40: echo request seq 15616
11:58:12.709583 IP 149.156.99.123 > 149.156.96.1: icmp 40: echo request seq 15872

